 [
  {
    "schema_version": 1,
    "question_id": "einstein-01",
    "qid": "Q937",
    "prompt": "/no_think\nAnswer with only the short answer and no explanation. In what year was Albert Einstein born?",
    "accepted_aliases": ["1879", "1879."],
    "source_provenance": "https://www.nobelprize.org/prizes/physics/1921/einstein/facts/"
  },
  {
    "schema_version": 1,
    "question_id": "einstein-02",
    "qid": "Q937",
    "prompt": "/no_think\nAnswer with only the short answer and no explanation. In which city was Albert Einstein born?",
    "accepted_aliases": ["Ulm", "Ulm.", "Ulm, Germany", "Ulm, Germany."],
    "source_provenance": "https://www.nobelprize.org/prizes/physics/1921/einstein/facts/"
  },
  {
    "schema_version": 1,
    "question_id": "einstein-03",
    "qid": "Q937",
    "prompt": "/no_think\nAnswer with only the short answer and no explanation. In what year did Albert Einstein die?",
    "accepted_aliases": ["1955", "1955."],
    "source_provenance": "https://www.nobelprize.org/prizes/physics/1921/einstein/facts/"
  },
  {
    "schema_version": 1,
    "question_id": "curie-01",
    "qid": "Q7186",
    "prompt": "/no_think\nAnswer with only the short answer and no explanation. In what year was Marie Curie born?",
    "accepted_aliases": ["1867", "1867."],
    "source_provenance": "https://www.nobelprize.org/prizes/physics/1903/marie-curie/facts/"
  },
  {
    "schema_version": 1,
    "question_id": "curie-02",
    "qid": "Q7186",
    "prompt": "/no_think\nAnswer with only the short answer and no explanation. In which city was Marie Curie born?",
    "accepted_aliases": ["Warsaw", "Warsaw.", "Warsaw, Poland", "Warsaw, Poland."],
    "source_provenance": "https://www.nobelprize.org/prizes/physics/1903/marie-curie/facts/"
  },
  {
    "schema_version": 1,
    "question_id": "curie-03",
    "qid": "Q7186",
    "prompt": "/no_think\nAnswer with only the short answer and no explanation. In what year did Marie Curie die?",
    "accepted_aliases": ["1934", "1934."],
    "source_provenance": "https://www.nobelprize.org/prizes/physics/1903/marie-curie/facts/"
  },
  {
    "schema_version": 1,
    "question_id": "new-york-city-01",
    "qid": "Q60",
    "prompt": "/no_think\nAnswer with only the short answer and no explanation. Which country is New York City in?",
    "accepted_aliases": ["United States", "United States.", "United States of America", "United States of America.", "USA", "USA.", "U.S.", "US"],
    "source_provenance": "https://portal.311.nyc.gov/article/?kanumber=KA-02877"
  },
  {
    "schema_version": 1,
    "question_id": "new-york-city-02",
    "qid": "Q60",
    "prompt": "/no_think\nAnswer with only the short answer and no explanation. Which U.S. state contains New York City?",
    "accepted_aliases": ["New York", "New York.", "New York State", "New York State.", "State of New York", "State of New York.", "NY", "N.Y."],
    "source_provenance": "https://portal.311.nyc.gov/article/?kanumber=KA-02877"
  },
  {
    "schema_version": 1,
    "question_id": "new-york-city-03",
    "qid": "Q60",
    "prompt": "/no_think\nAnswer with only the short answer and no explanation. How many boroughs does New York City have?",
    "accepted_aliases": ["5", "5.", "five", "five."],
    "source_provenance": "https://portal.311.nyc.gov/article/?kanumber=KA-02877"
  },
  {
    "schema_version": 1,
    "question_id": "los-angeles-01",
    "qid": "Q65",
    "prompt": "/no_think\nAnswer with only the short answer and no explanation. Which U.S. state is Los Angeles in?",
    "accepted_aliases": ["California", "California.", "State of California", "State of California.", "CA", "CA.", "Calif."],
    "source_provenance": "https://griffithobservatory.lacity.gov/about/city-of-los-angeles/"
  },
  {
    "schema_version": 1,
    "question_id": "los-angeles-02",
    "qid": "Q65",
    "prompt": "/no_think\nAnswer with only the short answer and no explanation. Which county contains Los Angeles?",
    "accepted_aliases": ["Los Angeles County", "Los Angeles County.", "County of Los Angeles", "County of Los Angeles.", "LA County", "LA County.", "L.A. County", "L.A. County."],
    "source_provenance": "https://griffithobservatory.lacity.gov/about/city-of-los-angeles/"
  },
  {
    "schema_version": 1,
    "question_id": "los-angeles-03",
    "qid": "Q65",
    "prompt": "/no_think\nAnswer with only the short answer and no explanation. In what year was Los Angeles founded?",
    "accepted_aliases": ["1781", "1781."],
    "source_provenance": "https://griffithobservatory.lacity.gov/about/city-of-los-angeles/"
  },
  {
    "schema_version": 1,
    "question_id": "un-01",
    "qid": "Q1065",
    "prompt": "/no_think\nAnswer with only the short answer and no explanation. In what year was the United Nations founded?",
    "accepted_aliases": ["1945", "1945."],
    "source_provenance": "https://www.un.org/en/about-us/history-of-the-un"
  },
  {
    "schema_version": 1,
    "question_id": "un-02",
    "qid": "Q1065",
    "prompt": "/no_think\nAnswer with only the short answer and no explanation. In which city is United Nations Headquarters?",
    "accepted_aliases": ["New York City", "New York City.", "New York", "New York.", "NYC", "NYC.", "New York, NY", "New York, NY."],
    "source_provenance": "https://www.un.org/en/about-us"
  },
  {
    "schema_version": 1,
    "question_id": "un-03",
    "qid": "Q1065",
    "prompt": "/no_think\nAnswer with only the short answer and no explanation. How many original UN Member States were there?",
    "accepted_aliases": ["51", "51.", "fifty-one", "fifty-one.", "fifty one", "fifty one."],
    "source_provenance": "https://www.un.org/en/about-us/history-of-the-un"
  },
  {
    "schema_version": 1,
    "question_id": "who-01",
    "qid": "Q7817",
    "prompt": "/no_think\nAnswer with only the short answer and no explanation. In what year was WHO founded?",
    "accepted_aliases": ["1948", "1948."],
    "source_provenance": "https://www.who.int/about/history/"
  },
  {
    "schema_version": 1,
    "question_id": "who-02",
    "qid": "Q7817",
    "prompt": "/no_think\nAnswer with only the short answer and no explanation. In which city is WHO headquartered?",
    "accepted_aliases": ["Geneva", "Geneva.", "Geneva, Switzerland", "Geneva, Switzerland."],
    "source_provenance": "https://www.who.int/about/frequently-asked-questions"
  },
  {
    "schema_version": 1,
    "question_id": "who-03",
    "qid": "Q7817",
    "prompt": "/no_think\nAnswer with only the short answer and no explanation. WHO is an agency of which organization?",
    "accepted_aliases": ["United Nations", "United Nations.", "UN", "UN.", "the UN", "the UN.", "United Nations Organization", "United Nations Organization."],
    "source_provenance": "https://www.who.int/about/frequently-asked-questions"
  },
  {
    "schema_version": 1,
    "question_id": "hamlet-01",
    "qid": "Q41567",
    "prompt": "/no_think\nAnswer with only the short answer and no explanation. Who wrote Hamlet?",
    "accepted_aliases": ["William Shakespeare", "William Shakespeare.", "Shakespeare", "Shakespeare."],
    "source_provenance": "https://www.folger.edu/explore/shakespeares-works/hamlet/"
  },
  {
    "schema_version": 1,
    "question_id": "hamlet-02",
    "qid": "Q41567",
    "prompt": "/no_think\nAnswer with only the short answer and no explanation. What broad genre is Hamlet?",
    "accepted_aliases": ["tragedy", "tragedy.", "a tragedy", "a tragedy.", "Shakespearean tragedy", "Shakespearean tragedy.", "revenge tragedy", "revenge tragedy."],
    "source_provenance": "https://www.folger.edu/explore/shakespeares-works/hamlet/"
  },
  {
    "schema_version": 1,
    "question_id": "hamlet-03",
    "qid": "Q41567",
    "prompt": "/no_think\nAnswer with only the short answer and no explanation. Who is the protagonist of Hamlet?",
    "accepted_aliases": ["Hamlet", "Hamlet.", "Prince Hamlet", "Prince Hamlet.", "Hamlet, Prince of Denmark", "Hamlet, Prince of Denmark."],
    "source_provenance": "https://www.folger.edu/explore/shakespeares-works/hamlet/"
  },
  {
    "schema_version": 1,
    "question_id": "mona-lisa-01",
    "qid": "Q12418",
    "prompt": "/no_think\nAnswer with only the short answer and no explanation. Who painted the Mona Lisa?",
    "accepted_aliases": ["Leonardo da Vinci", "Leonardo da Vinci."],
    "source_provenance": "https://www.louvre.fr/en/explore/the-palace/from-the-mona-lisa-to-the-wedding-feast-at-cana"
  },
  {
    "schema_version": 1,
    "question_id": "mona-lisa-02",
    "qid": "Q12418",
    "prompt": "/no_think\nAnswer with only the short answer and no explanation. Which museum houses the Mona Lisa?",
    "accepted_aliases": ["Louvre Museum", "Louvre Museum.", "the Louvre", "the Louvre.", "Louvre", "Louvre.", "Musee du Louvre", "Musee du Louvre."],
    "source_provenance": "https://www.louvre.fr/en/explore/the-palace/from-the-mona-lisa-to-the-wedding-feast-at-cana"
  },
  {
    "schema_version": 1,
    "question_id": "mona-lisa-03",
    "qid": "Q12418",
    "prompt": "/no_think\nAnswer with only the short answer and no explanation. In which city is the Mona Lisa currently displayed?",
    "accepted_aliases": ["Paris", "Paris.", "Paris, France", "Paris, France."],
    "source_provenance": "https://www.louvre.fr/en/visit/map-entrances-directions"
  }
]
